{
  "id": "https://www.qa.ch/testautomation/testcase/schema#",
  "$schema": "http://json-schema.org/draft-07/schema#",
  "title": "RCH Test Framework - Test Case Schema",
  "type": "object",
  "properties": {
    "meta": {
      "type": "array",
      "description": "Meta Filter for Test Case Selection",
      "items": {
        "uniqueItems": true,
        "type": "string"
      }
    },
    "name": {
      "type": "string",
      "description": "Test Case Name. Validated with folder name pattern.",
      "pattern": "^[^\\s^\\x00-\\x1f\\\\?*:\"\";<>|\\/.][^\\x00-\\x1f\\\\?*:\"\";<>|\\/]*[^\\s^\\x00-\\x1f\\\\?*:\"\";<>|\\/.]+$"
    },
    "type": {
      "type": "string",
      "description": "Test Case Type, the test driver depends on the type",
      "enum": [
        "app",
        "web_app",
        "web_app_remote",
        "mobile_app",
        "mobile_web_app",
        "mobile_ios",
        "mobile_android",
        "rest"
      ]
    },
    "description": {
      "type": "string",
      "description": "Test Case Description"
    },
    "source": {
      "type": "string",
      "description": "where the test case originally stored.",
      "enum": [
        "TFS",
        "AzureDevOps",
        "JIRA"
      ]
    },
    "testCaseId": {
      "type": "string",
      "description": "Test Case ID, reference to external manual test case that storage in test case management system like QC, JIRA..."
    },
    "testCaseIdMap": {
      "type": "object",
      "description": "(mobile_app only) Test Case ID Map with key for platform of device, reference to external manual test case that storage in test case management system like QC, JIRA...",
      "examples": [
        {
          "iOS": "id1",
          "Android": "id2"
        }
      ]
    },
    "requirement": {
      "type": "string",
      "description": "Requirement reference similar to test case id"
    },
    "reference": {
      "type": "string",
      "description": "External extra Reference, optional information"
    },
    "screenshotLevel": {
      "type": "string",
      "enum": [
        "ERROR",
        "SUCCESS"
      ],
      "description": "screen shot will be taken on given level"
    },
    "testDataRef": {
      "type": "string",
      "examples": [
        "File:MyData.json",
        "File:testData/AT/multiCase.csv",
        "SQL:testData/AT/SQLs/mySQL.sql"
      ],
      "description": "Test Data Reference, File, sql statement or also DB interface."
    },
    "additionalTestDataFile": {
      "type": "string",
      "description": "Test Data Reference, json file only.",
      "examples": [
        "File:testData/MyData.json"
      ]
    },
    "appName": {
      "type": "string",
      "description": "Name Display of iOS app for mobile testing.",
      "examples": [
        "xxx.xxxx.google..."
      ]
    },
    "appPackage": {
      "type": "string",
      "description": "(Android only) Start point of Android app for mobile testing.",
      "examples": [
        "xxx.xxxx.google..."
      ]
    },
    "bundleId": {
      "type": "string",
      "description": "Bundle ID for iOS mobile testing.",
      "examples": [
        "xxx.xxxx.google..."
      ]
    },
    "activity": {
      "type": "string",
      "description": "(Android only) Start point of android app for mobile testing.",
      "examples": [
        "xxx.xxx.xxx.xxx.twint..."
      ]
    },
    "seriesNumber": {
      "type": "string",
      "description": "Test Series number for execution sequence of test case with meta",
      "examples": [
        "seriesNumber:suite.1.case.01",
        "seriesNumber:suite.1.case.02"
      ]
    },
    "story": {
      "type": "string",
      "description": "Story description of the test case.",
      "examples": [
        "User tries to login the system with invalid username and invalid password."
      ]
    },
    "epic": {
      "type": "string",
      "description": "Epic description of the test case.",
      "examples": [
        "Login Tests Epic."
      ]
    },
    "feature": {
      "type": "string",
      "description": "Feature description of the test case.",
      "examples": [
        "Invalid Login Features."
      ]
    },
    "startURL": {
      "type": "string",
      "description": "Start url for the test object.",
      "examples": [
        "https://www.myPage.com/login"
      ]
    },
    "steps": {
      "type": "array",
      "description": "Test Case Steps",
      "items": {
        "type": "object",
        "properties": {
          "name": {
            "type": "string",
            "description": "Test step name that implemented in java method with annotation like @TestStep(name=\"my Step\")."
          },
          "testObject": {
            "type": "string",
            "description": "Test page object name that implemented in java class with annotation like @TestObject(name=\"my Step\")."
          },
          "using": {
            "type": "string",
            "description": "To override the method definition of parameters in annotation like @TestStep(using=\"myData.user\")."
          },
          "comment": {
            "type": "string",
            "description": "Comment for additional step info as such special identifier usefully for report"
          },
          "takeScreenshot": {
            "type": "boolean",
            "enum": [
              true,
              false
            ],
            "description": "To specify the screen shot taken strategy only for the step."
          },
          "stopOnError": {
            "type": "boolean",
            "enum": [
              true,
              false
            ],
            "description": "To specify the stop on error strategy only for the step."
          }
        },
        "required": [
          "name",
          "testObject"
        ]
      }
    }
  },
  "required": [
    "meta",
    "name",
    "type",
    "description",
    "screenshotLevel",
    "testDataRef",
    "steps"
  ]
}