{
  "meta": [
    "@testDemo"
  ],
  "name": "Demo Test",
  "type": "web_app",
  "description": "Demo Test Case",
  "source": "TFS",
  "testCaseId": "",
  "requirement": "",
  "reference": "",
  "screenshotLevel": "ERROR",
  "testDataRef": "File:google-testData.json",
  "startURL": "https://formstone.it/components/dropdown/demo/",
  "seriesNumber": "",
  "steps": [
    {
      "name": "Test Demo",
      "testObject": "Demo Page"
    }
  ]
}