{
  "meta": [
    "@nightly",
    "@CI",
    "@demo",
    "@demo6"
  ],
  "name": "Google Demo Test Case 6",
  "type": "web_app",
  "description": "Demo Test Case of Google home page 6",
  "source": "TFS",
  "testCaseId": "",
  "requirement": "",
  "reference": "",
  "screenshotLevel": "ERROR",
  "testDataRef": "File:testData/google-testData.json",
  "startURL": "https://www.google.de",
  "seriesNumber": "",
  "steps": [
    {
      "name": "Check Fields Presents",
      "testObject": "Google Home Page"
    },
    {
      "name": "Search Text",
      "testObject": "Google Home Page"
    },
    {
      "name": "Check First Entry of Search Result",
      "testObject": "Search Result Page"
    },
    {
      "name": "Search Text Twice",
      "testObject": "Google Home Page"
    }
  ]
}