{
  "meta": [
    "@demo1.6",
    "@all"
  ],
  "name": "Google Demo Test Case 6",
  "type": "web_app",
  "description": "Demo Test Case 6 with GlobalTestData File",
  "source": "TFS",
  "testCaseId": "",
  "requirement": "",
  "reference": "",
  "screenshotLevel": "ERROR",
  "testDataRef": "File:testData/google-testData.json",
  "startURL": "https://www.google.ch",
  "steps": [
    {
      "name": "Check Fields Present",
      "testObject": "Google Home Page"
    },
    {
      "name": "Global Search Text",
      "testObject": "Google Home Page",
      "comment": "Die Daten werden aus der File demo-testdata-global.json gelesen"
    },
    {
      "name": "Search Text",
      "testObject": "Google Home Page"
    }
  ]
}