{
  "meta": [
    "@nightly",
    "@CI",
    "@demo2",
    "@demo23"
  ],
  "name": "Google Demo Test Case 2",
  "type": "web_app",
  "description": "Demo Test Case of Google home page 2",
  "source": "TFS",
  "testCaseId": "",
  "requirement": "",
  "reference": "",
  "screenshotLevel": "ERROR",
  "testDataRef": "File:google-testData.json",
  "startURL": "https://www.google.ch",
  "seriesNumber": "",
  "steps": [
    {
      "name": "Check Fields Present",
      "testObject": "Google Home Page"
    },
    {
      "name": "Check Page Title",
      "testObject": "Google Home Page",
      "using": "pageTitle1"
    },
    {
      "name": "Search Text",
      "testObject": "Google Home Page"
    },
    {
      "name": "Check First Entry of Search Result",
      "testObject": "Search Result Page"
    },
    {
      "name": "Search Text Twice",
      "testObject": "Google Home Page"
    },
    {
      "name": "Search Text Triple",
      "testObject": "Google Home Page"
    },
    {
      "name": "Search List",
      "testObject": "Google Home Page"
    }
  ]
}