{
  "meta": [
    "@demo1.4",
    "@all"
  ],
  "name": "Google Demo Test Case 4",
  "type": "web_app",
  "description": "Demo Test Case 4 with Check search with map",
  "source": "TFS",
  "testCaseId": "",
  "requirement": "",
  "reference": "",
  "screenshotLevel": "ERROR",
  "testDataRef": "File:testData/google-testData.json",
  "startURL": "https://www.google.ch",
  "steps": [
    {
      "name": "Check Fields Present",
      "testObject": "Google Home Page"
    },
    {
      "name": "Check Page Title ää",
      "testObject": "Google Home Page",
      "comment": "Das ist ein Kommentar"
    },
    {
      "name": "Search Text",
      "testObject": "Google Home Page"
    },
    {
      "name": "Check Fields Present",
      "testObject": "Search Result Page"
    },
    {
      "name": "Check First Entry of Search Result",
      "testObject": "Search Result Page",
      "using": "searchResultEntry"
    },
    {
      "name": "Check search with map",
      "testObject": "Search Result Page"
    }
  ]
}