{
  "meta": [
    "@focusIOS"
  ],
  "name": "Demo IOS Try",
  "type": "mobile_ios",
  "description": "Demo Test Case of ios twint",
  "source": "TFS",
  "testCaseId": "",
  "requirement": "",
  "reference": "",
  "screenshotLevel": "ERROR",
  "testDataRef": "File:testData/google-testData.json",
  "appName": "ch.raiffeisen.twint",
  "steps": [
    {
      "name": "Check Fields Present",
      "testObject": "ios login page"
    }
  ]
}