{
  "meta": [
    "@test",
    "@nightly",
    "@CI",
    "@demo",
    "@demo1"
  ],
  "name": "Google Demo Test Case 1",
  "type": "web_app",
  "description": "Demo Test Case of Google home page 1",
  "source": "TFS",
  "testCaseId": "",
  "requirement": "",
  "reference": "",
  "screenshotLevel": "ERROR",
  "testDataRef": "File:testData/google-testData1.csv",
  "startURL": "",
  "steps": [
    {
      "name": "Start Up",
      "testObject": "Google Home Page"
    },
    {
      "name": "Check Fields Present",
      "testObject": "Google Home Page"
    },
    {
      "name": "Check Page Title",
      "testObject": "Google Home Page"
    },
    {
      "name": "Search Text",
      "testObject": "Google Home Page"
    },
    {
      "name": "Search Text Twice",
      "testObject": "Google Home Page"
    }
  ]
}